{"schema_version":"1.1","source":{"name":"LDraw.org Official Parts Library","kind":"fixture","release":"fixture","fingerprint":"sha256:922ac54c253aef44372fd2a2c6ffe29d8a383ab2fe997cb2266c233a83ae1dbe","canonical_url":"https://example.invalid/fixture"},"statistics":{"indexed_files":2,"usable_parts":2,"colors":9},"colors":{"0":{"name":"Black"},"1":{"name":"Blue"},"2":{"name":"Green"},"4":{"name":"Red"},"7":{"name":"Light Grey"},"14":{"name":"Yellow"},"15":{"name":"White"},"16":{"name":"Main Colour"},"24":{"name":"Edge Colour"}},"parts":{"3001.dat":{"description":"Brick  2 x  4","library_type":"Part","qualifiers":[],"usable_as_model_part":true},"3003.dat":{"description":"Brick  2 x  2","library_type":"Part","qualifiers":[],"usable_as_model_part":true}}}
